[
  {
    "id": "solinco-confidential-16",
    "name": "Solinco Confidential",
    "gauge": "16 (1.30mm)",
    "gaugeNum": 1.3,
    "material": "Polyester",
    "shape": "Square/4-pointed edges",
    "stiffness": 222.3,
    "tensionLoss": 22.2,
    "spinPotential": 6.4,
    "twScore": {
      "power": 42,
      "spin": 90,
      "comfort": 63,
      "control": 93,
      "feel": 83,
      "playabilityDuration": 88,
      "durability": 91
    },
    "identity": "Control Lockdown",
    "notes": "Stiff poly (222 lb/in) with excellent tension maintenance (22% loss — top tier). Four grippy edges for spin. Needs 3-4 hrs break-in. Rewards full swings with pinpoint accuracy."
  },
  {
    "id": "solinco-hyper-g-16",
    "name": "Solinco Hyper-G",
    "gauge": "16 (1.30mm)",
    "gaugeNum": 1.3,
    "material": "Polyester",
    "shape": "Pentagon/5-sided",
    "stiffness": 219.5,
    "tensionLoss": 26.3,
    "spinPotential": 7,
    "twScore": {
      "power": 50,
      "spin": 92,
      "comfort": 62,
      "control": 88,
      "feel": 80,
      "playabilityDuration": 80,
      "durability": 88
    },
    "identity": "Spin Shredder",
    "notes": "Iconic green poly. Pentagon shape bites the ball aggressively. Slightly softer than Confidential with a bit more power. Good all-around aggressive poly."
  },
  {
    "id": "solinco-tour-bite-16",
    "name": "Solinco Tour Bite",
    "gauge": "16 (1.30mm)",
    "gaugeNum": 1.3,
    "material": "Polyester",
    "shape": "Pentagon/5-sided",
    "stiffness": 202.9,
    "tensionLoss": 47.1,
    "spinPotential": 6.7,
    "twScore": {
      "power": 38,
      "spin": 88,
      "comfort": 52,
      "control": 95,
      "feel": 78,
      "playabilityDuration": 70,
      "durability": 90
    },
    "identity": "Iron Maiden",
    "notes": "Very firm, very controlled. High tension loss (47%) means it starts tight and opens up quickly. Stiff but not as stiff as Confidential. For players who want maximum control and don't mind frequent restrings."
  },
  {
    "id": "babolat-rpm-blast-17",
    "name": "Babolat RPM Blast",
    "gauge": "17 (1.25mm)",
    "gaugeNum": 1.25,
    "material": "Polyester",
    "shape": "Octagonal",
    "stiffness": 234,
    "tensionLoss": 33.3,
    "spinPotential": 4.6,
    "twScore": {
      "power": 55,
      "spin": 82,
      "comfort": 60,
      "control": 85,
      "feel": 80,
      "playabilityDuration": 72,
      "durability": 82
    },
    "identity": "The Pro Standard",
    "notes": "Nadal's string. Very stiff (234 lb/in). Moderate tension loss. TWU spin potential is low (4.6) but real-world spin comes from snap-back of the octagonal shape. Good power for a poly."
  },
  {
    "id": "babolat-vs-touch-16",
    "name": "Babolat VS Touch",
    "gauge": "16 (1.30mm)",
    "gaugeNum": 1.3,
    "material": "Natural Gut",
    "shape": "Round (braided)",
    "stiffness": 140,
    "tensionLoss": 12,
    "spinPotential": 5,
    "twScore": {
      "power": 85,
      "spin": 65,
      "comfort": 98,
      "control": 65,
      "feel": 95,
      "playabilityDuration": 95,
      "durability": 50
    },
    "identity": "The Silk Cannon",
    "notes": "Gold standard natural gut. Softest stiffness (~140 lb/in), best tension maintenance (12% loss), maximum comfort and feel. High power, lower control ceiling. Fragile in wet conditions. Best pocketing of any string material."
  },
  {
    "id": "luxilon-alu-power-16l",
    "name": "Luxilon ALU Power",
    "gauge": "16L (1.25mm)",
    "gaugeNum": 1.25,
    "material": "Polyester",
    "shape": "Round",
    "stiffness": 209.2,
    "tensionLoss": 46.6,
    "spinPotential": 5.8,
    "twScore": {
      "power": 65,
      "spin": 78,
      "comfort": 58,
      "control": 82,
      "feel": 85,
      "playabilityDuration": 60,
      "durability": 80
    },
    "identity": "Legacy Standard",
    "notes": "The most famous poly. Good feel and power for a poly but terrible tension maintenance (47% loss). Goes dead fast. The string that defined the poly era but showing its age."
  },
  {
    "id": "restring-sync",
    "name": "ReString Sync",
    "gauge": "17 (1.24mm)",
    "gaugeNum": 1.24,
    "material": "Polyester",
    "shape": "Round (coated)",
    "stiffness": 195,
    "tensionLoss": 18,
    "spinPotential": 6.8,
    "twScore": {
      "power": 55,
      "spin": 82,
      "comfort": 72,
      "control": 85,
      "feel": 78,
      "playabilityDuration": 92,
      "durability": 88
    },
    "identity": "The Endurance Build",
    "notes": "Outstanding tension maintenance (~18% loss). Coated surface resists notching. Slightly muted feel compared to ALU Power but vastly superior playability duration. Good spin and comfort for its control level."
  },
  {
    "id": "restring-zero",
    "name": "ReString Zero",
    "gauge": "17 (1.24mm)",
    "gaugeNum": 1.24,
    "material": "Polyester",
    "shape": "Round (textured coating)",
    "stiffness": 188,
    "tensionLoss": 20,
    "spinPotential": 7.5,
    "twScore": {
      "power": 58,
      "spin": 88,
      "comfort": 70,
      "control": 82,
      "feel": 80,
      "playabilityDuration": 88,
      "durability": 82
    },
    "identity": "The Spin Tank",
    "notes": "More snap-back than Sync. Better spin access but slightly less tension maintenance and durability. More textured coating gives better ball bite. Good blend of spin and longevity."
  },
  {
    "id": "head-lynx-tour-17",
    "name": "Head Lynx Tour",
    "gauge": "17 (1.25mm)",
    "gaugeNum": 1.25,
    "material": "Polyester",
    "shape": "Square",
    "stiffness": 217.7,
    "tensionLoss": 24.6,
    "spinPotential": 7.1,
    "twScore": {
      "power": 48,
      "spin": 88,
      "comfort": 62,
      "control": 88,
      "feel": 80,
      "playabilityDuration": 82,
      "durability": 86
    },
    "identity": "The Consistent Edge",
    "notes": "Square profile for spin, good tension maintenance (24.6% loss). Pairs well with Speed frames. Stiff and controlled with decent playability duration."
  },
  {
    "id": "head-hawk-power-17",
    "name": "Head Hawk Power",
    "gauge": "17 (1.25mm)",
    "gaugeNum": 1.25,
    "material": "Polyester",
    "shape": "Spiral",
    "stiffness": 203.5,
    "tensionLoss": 48.3,
    "spinPotential": 7.5,
    "twScore": {
      "power": 60,
      "spin": 86,
      "comfort": 65,
      "control": 80,
      "feel": 78,
      "playabilityDuration": 65,
      "durability": 78
    },
    "identity": "Power Spinner",
    "notes": "More power and spin than Lynx Tour but much worse tension maintenance (48%). Spiral shape generates good ball bite. Loses playability relatively fast."
  },
  {
    "id": "tecnifibre-razor-soft-17",
    "name": "Tecnifibre Razor Soft",
    "gauge": "17 (1.25mm)",
    "gaugeNum": 1.25,
    "material": "Polyester",
    "shape": "Round",
    "stiffness": 212,
    "tensionLoss": 33.3,
    "spinPotential": 7.4,
    "twScore": {
      "power": 52,
      "spin": 82,
      "comfort": 70,
      "control": 84,
      "feel": 82,
      "playabilityDuration": 78,
      "durability": 80
    },
    "identity": "Comfort Control",
    "notes": "Good blend of comfort and control. Moderate stiffness and tension loss. A safe all-arounder poly."
  },
  {
    "id": "toroline-o-toro-17",
    "name": "Toroline O-Toro",
    "gauge": "17 (1.23mm)",
    "gaugeNum": 1.23,
    "material": "Polyester",
    "shape": "Hexagonal",
    "stiffness": 165.7,
    "tensionLoss": 44.4,
    "spinPotential": 9.4,
    "twScore": {
      "power": 60,
      "spin": 95,
      "comfort": 75,
      "control": 78,
      "feel": 75,
      "playabilityDuration": 72,
      "durability": 78
    },
    "identity": "Spin Launcher",
    "notes": "TWU spin potential 9.4 — top tier. 104% more spin than RPM Blast in lab testing. Very soft at 166 lb/in. High tension loss (44%) means it opens up fast. Hexagonal shape with exceptional snapback. Best-selling Toroline string."
  },
  {
    "id": "toroline-o-toro-spin-17",
    "name": "Toroline O-Toro Spin",
    "gauge": "17 (1.23mm)",
    "gaugeNum": 1.23,
    "material": "Polyester",
    "shape": "Textured Hexagonal",
    "stiffness": 173.2,
    "tensionLoss": 38.3,
    "spinPotential": 8.2,
    "twScore": {
      "power": 55,
      "spin": 90,
      "comfort": 72,
      "control": 82,
      "feel": 73,
      "playabilityDuration": 74,
      "durability": 80
    },
    "identity": "Textured Spin Machine",
    "notes": "Textured version of O-Toro with slightly higher stiffness (173 vs 166). Better tension maintenance (38% vs 44%). Slightly less peak spin but more controlled response. Good middle ground between O-Toro and O-Toro Tour."
  },
  {
    "id": "toroline-o-toro-tour-17",
    "name": "Toroline O-Toro Tour",
    "gauge": "17 (1.23mm)",
    "gaugeNum": 1.23,
    "material": "Polyester",
    "shape": "Hexagonal",
    "stiffness": 216.6,
    "tensionLoss": 25,
    "spinPotential": 7.7,
    "twScore": {
      "power": 48,
      "spin": 85,
      "comfort": 65,
      "control": 90,
      "feel": 80,
      "playabilityDuration": 85,
      "durability": 88
    },
    "identity": "Tour Control Hex",
    "notes": "~15% stiffer than O-Toro, comparable to RPM Blast and 4G. TWU tension loss only 25% — excellent. Higher stiffness (217) gives more control and stability at high swing speeds. Best for advanced players who want control-first with spin access."
  },
  {
    "id": "toroline-o-toro-snap-16l",
    "name": "Toroline O-Toro Snap",
    "gauge": "16L (1.25mm)",
    "gaugeNum": 1.25,
    "material": "Polyester",
    "shape": "Round (ultra-slick)",
    "stiffness": 170,
    "tensionLoss": 40,
    "spinPotential": 8.5,
    "twScore": {
      "power": 58,
      "spin": 88,
      "comfort": 73,
      "control": 80,
      "feel": 76,
      "playabilityDuration": 75,
      "durability": 80
    },
    "identity": "Snapback Specialist",